Alyeth_,['overdose'],"b'@bleepblorp69420 @UndeadRed85 @crulge You literally cited the Brookings Insistute lol, the think tank that suggested the best way to reduce total opioid overdoses was to stop administering narcan to people who overdose.'"
Data_Surfer,['alcohol'],b'@pmarca Is the opioid epidemic actually a problem? Yes. Is banning opioids a good idea? No. (It did not work with alcohol either.) Should we ban opioids then? No. Is the opioid epidemic the current thing? Oh yes.'
GreenDarkAge5_,['depression'],"b'@dubmecrazypdx @firstjohnsmith 60-70% of transgender report feelings of depression. \n\nThink of it this way, legalizing all drugs would create ""more rights"" as liberals like seeing it, but would create a greater opioid epidemic that what we have now. It serves no use- just like gender identity theory.'"
RaShon1984,['enough'],"b'@Cokedupoptions If Elon Musk spent 4% of his net worth, he could solve the opioid crisis, free the Uyghurs, end racism completely, solve climate change, end student debt, and he would still have enough money  to give every gender fluid person of colour 1 billion dollars.'"
mybarkingdogs,['legal'],"b""@ChristinaBDent @yoopermegs0526 This, and before people mention the legal opioids crisis as a counterpoint I'll add that a) Purdue Pharma's and Insys's etc marketing/sales was identical to *illegal* drug dealers and failure to stop them using existing legal restrictions was why there was an opioid crisis 1/2"""
tylerblack32,['overdose'],"b""@DaveAtkinsonMD yes - tainted drug supply due to lack of supply chains. this is well established and an extremely well-supported fact in both toxicology studies of opioid deaths during the pandemic as well as interviews of overdose survivors.\n\nastonishing you don't know this"""
salsa_valverde,['issues'],"b""@JacquelynGill I agree. while there are some serious opioid issues people like my girlfriend have legitimate conditions (bi weekly migraine) that only codeine can neutralise once it's taken hold. Her GP won't prescribe it. Seeing her in extreme pain is awful."""
AlianaHermes66,['enough'],"b'@NathanMackBrown No.  Because ever since the ""opioid crisis"" caused the pain meds (Tramadol) to be cut to 30% if what I need, I have a problem just standing in my kitchen long enough to cook pasta.  I stay on top of absentee ballots for this reason.'"
WolfiePupTravis,['overdose'],b'@MittensDaKatje My city is the leading city in the entire province with opioid overdose related deaths. There\xe2\x80\x99s literally no support in my city. Your worker frequently changes and if anything makes you feel worse. And that\xe2\x80\x99s how I\xe2\x80\x99ve just remained antisocial because of lack of resources'
RepDavidLinsky,['overdose'],"b'@MassAGO announced MA cities and towns will split more than $210 million in money paid by opioid manufacturers and distributors, while state government will get another $310 million to invest in ongoing efforts to rein in the addiction and overdose epidemic (1/2)'"
Angel2bme,['prison'],"b'What kind of Country do we live in that, makes a law 4 opioid RXing that fatally failed w so many innocent ppls lives lost as a result of it, doesn\xe2\x80\x99t go back &amp; rescind that law. YES DAMNED IT! It\xe2\x80\x99s LAW! Ask the innocent Drs in prison about it!  @CDCgov must \n#Rescind2016GLs'"
RexChapman,['legal'],b'They started the opioid epidemic with OxyContin . Hundreds of thousands now dead. They paid $6-billion to get out of legal trouble. Just the cost of doing drug business in America.'
CoffeeAndPaul,['prison'],"b""@expeedee @AngieSkys The results are predictable. A Russian man's life is 8 YEARS SHORTER than the Chinese man who lives almost next door. Russia still treats alcoholism with stints in mental health wards. They have an opioid crisis that's blowing the roofs off their prison and hospital systems."""
Bigzolj,['overdose'],b'@kemu808 80000 people die of opioid overdose a year! Which mostly coming through our southern boarder! So i doubt this post is accurate!!!\xe2\x80\x99'
Trumpgot2go,['anxiety'],"b'@Mainekindxl Plus, everyone loves it &amp; it could end a lot of opioid use for pain, benzos for anxiety. You name it!'"
Angel2bme,['prison'],b'@DOJCrimDiv Can I explain why ur division is doing NOTHING about about the DEA arresting Drs &amp; how the DOJ has illegally sentenced those Drs to prison when the @CDCgov claims their 2016 opioid GLs were NOT intended to be LAW but just GLs? Is the DEA more powerful than you? Do you'
RobProud,['legal'],b'@TFJansson @leftist_debater @AdamJSchwarz @georgegalloway @TwitterSupport Corporate funded media is worse especially when companies like Pfizer are complicit in the ongoing Opioid Crisis and are lobbying the government for protection against legal cases against them.\n\nThat is the sign of true scumbag media!'
AdamsPebbles,['alcohol'],b'@ChrisJGoodin The @CDCInjury @CDCgov read all these terrible stories of pain patients suffering over a fake opioid crisis. We know street drugs like fentanyl and heroine alone or mixed with alcohol is deadly. Pain patients shouldn\xe2\x80\x99t have to suffer. Deadline for comments on CDC website 4/11-22'
plwin49,['rely'],"b'@SenWarren Senator Warren, while I agree with you on most everything, I strongly urge you to take a deeper look at the devastation that the prescription opioid cutbacks have caused pain patients who rely on these medications for the ability to function &amp; have QOL. Please review.'"
LawrenceMuir1,['overdose'],"b'@ElizabethHeckm9 When I was in the White House in 2017, we had 58,000 opioid overdose deaths. In 2021 the number topped 100,000. With an open border the amount of fentanyl, black tar heroin, etc. from the cartels will have OD deaths spiking at significant rates. Natsec and public health disaster.'"
ClownShifty,['problems'],"b'@JDVance1 Lack of mental health, Increased poverty &amp; disparity are at the root of the Opioid Epidemic.\nThese are problems you and your party actively, purposely do nothing about.\nYou give tax cuts to the rich and prey upon the ignorant and the poor. Your solutions are thoughts and prayers.'"
GimsonSusana,['alcohol'],"b'@buddman4 @Greachain @XDarkSyntaX @morningkhat NA strives for a complete and continued abstinence from drugs and alcohol to support personal growth and a strong foundation for recovery. Since the NA philosophy calls for total abstinence from drugs, this can often include those prescribed in MAT to treat opioid use disorder'"
RaShon1984,['enough'],"b'@SenWarren @POTUS Elon Musk could pay off my student loan debt, gambling debt, credit card debt, and still have enough money to solve world hunger, climate change, end the war in ukraine, and solve the opioid crisis. Why won\xe2\x80\x99t he do it?'"
LatimoreAmanda,['overdose'],"b""Who has talked to people who uses drugs about how the weather (hot or cold days) changes how they use drugs? I know research has described the impact on overdose (hot days, more stimulant OD; cold days, more opioid OD) but I'm talking about strategies that ppl use to stay safe."""
JesusITrustInU4,['overdose'],"b'Fentanyl, also spelled fentanil, is a powerful opioid used as a pain medication and, together with other medications, for anesthesia. It is also used as a recreational drug, sometimes mixed with heroin, cocaine, or methamphetamine. Its potentially deadly overdose effects can be'"
Here4LeftyNews,['enough'],"b""@ElieNYC Not a one.\nOpioid Ohio likes em mean, stupid and racist.\nIt's so embarrassing living here.\nDon't know how @SenSherrodBrown survives it all.\nReally. There isn't a dumpster big enough."""
Yes01771917,['overdose'],b'@spittinchiclets What\xe2\x80\x99s the over under on when this guy dies of an opioid overdose?\n\nI hope I\xe2\x80\x99m wrong and he lives a long healthy life'
maiasz,['problems'],"b'@CivilRights Why are there no examples of rehabs and sober homes excluding people on medication, when this is one of the biggest problems faced by people seeking help for opioid addiction? Are you going to bring cases against this common practice?'"
JDCcamp25,['legal'],"b'@davematt88 I\xe2\x80\x99d say, they\xe2\x80\x99re thinking of a way to molest children. But, let\xe2\x80\x99s ask @MarshaBlackburn and get her thoughts. \n\nWell, Marsha, I know it\xe2\x80\x99s hard to see behind that pile of money from opioid manufacturers. But, you cool with the \xe2\x80\x98Let\xe2\x80\x99s make it legal to have sex with kids\xe2\x80\x99 law?'"
OJPNIJ,['overdose'],"b'U.S. opioid-related overdose deaths have increased significantly in recent years, topping 49,860 in 2019. Learn about NIJ-funded research to disrupt illicit opioid distribution networks through data-driven network analysis and citizen intelligence.'"
senatorERM,['overdose'],"b'During the training, participants will learn how to recognize the signs and symptoms of opioid overdose and how to administer the nasal spray to help someone in need. Each participant will receive a free Narcan nasal spray kit.'"
aneripattani,['legal'],b'5/ Critics say the first big question the funding raises \xe2\x80\x94 and one that should be considered for future opioid settlement $ too \xe2\x80\x94 is:\n \n**Are rehabs that make residents work without pay legal or ethical?**'
PerioperativeM2,['enough'],b'#FDA committees recommended against the approval of a New #drug Application (NDA) for IV tramadol (Avenue Therapeutics) for the #treatment of acute pain that is severe enough to require an opioid analgesic in an inpatient setting. The #Anesthetic &amp; Analgesic #drug Products.'
MichelleJULIEN8,['enough'],"b'#fentanyl ""A new synthetic drug is killing more than gun crime, homicide, and car accidents combined. 100 times stronger than heroin, the deadly opioid fentanyl is cheap, potent, and small enough to send in the post.'"
HamboneMc,['alcohol'],"b""@Eirerogue00 @KennedyNation @RepMcClintock Thanks to cannabis I haven't had a benzo of opioid in over 4 years, no cocaine in over 1 year, and no alcohol in over 6 months. After 15+ years of serious abuse of all of those, #cannabis was my #ExitDrug #legalizehappiness"""
autumnskye72,['issues'],"b'@JDVance1 So what are you doing to help opioid addicts? And how are you holding big pharma, the actual bad guys here, accountable? NM - I forgot for a minute that I was asking a member of a party who drums up hate to keep people distracted from the real issues \xf0\x9f\x99\x84'"
ScottMo43480713,['enough'],"b""@hereandtherean1 @L0m3z @Steve_Sailer There have been massive fines and lawsuits over Opioid overprescription that have made them tougher to access through GPs and regular channels \n\nThat would be beneficial for puberty blockers and hormone replacers, but without cultural oppobrium, it wouldn't be enough"""
jayardot1,['stressful'],"b""@derekjones3111 @Gray55794554 @bigcons244 @KyleRiegel222 @class_s_nobody Having a heart condition means stressful situations full of adrenaline require more oxygen than a normal person would. He didn't display signs of an opioid OD."""
Janelle07033308,['issues'],"b""@Catmom7114 @ibdgirl76 The issues with this is why would Dr's not question if the 90mme cause so much harm how come is 50 mme now. And as most of us know this was meant for first time treatment W/ opioids for opioid nieve patients?"""
jayardot1,['overdose'],"b""@David28922165 @DefiantLs If his lungs weren't compressed for 8+ minutes he may have been alive too. At least that's what the medical examiner said. And I'm pretty sure procedure for an opioid overdose is to give them naloxone. Not to murder the person. But again, you must be the expert."""
missamanda000,['criminal'],"b""@chimmiechoo @RBReich What's to be expected from someone who has a company in their name that has killed people, is responsible for the opioid epidemic, and been fined billions in civil and criminal though? \xf0\x9f\xa4\xb7\xe2\x80\x8d\xe2\x99\x80\xef\xb8\x8f"""
katman_steven,['issues'],b'@MoneyMonroeSays \xe2\x80\x9cReefer Madness\xe2\x80\x9d was the propaganda film with the purpose of feeding the public with lies. 80 years later &amp; the narrative is reversed\nNow it\xe2\x80\x99s with opioid Meds for legitimate pain issues. Only we are made to look like addicts because there\xe2\x80\x99s more money in Suboxone &amp; treatment'
benryanwriter,['overdose'],b'@maggieNYT This is how a few people finally realized nearly a year after the fact that my cousin had died of an opioid overdose. They went to wish her happy birthday and instead saw my eulogy post about her in her feed and contacted me mystified and saddened.'
FuzzyNuts8,['criminal'],"b'@Happyjustice4 @rsciuk @Polysesouvient Just like ban all drugs. Well fuck me, there\xe2\x80\x99s not a back yard safe from the eyes of an opioid addicted criminal for 200 miles from here and all those god damn drugs their on are BANNED already. Fuckin open borders bro. You want it, they got it and it\xe2\x80\x99ll get here from anywhere'"
CrzyWx,['legal'],"b'What\xe2\x80\x99s funny is all this stuff it\xe2\x80\x99s automatically considered opioid use disorder but there isn\xe2\x80\x99t a competitive legal drug - so, I never misused my opioids- they don\xe2\x80\x99t work for spasms, which is a big part of my pain disorder- my muscles pull bones out of place, it\xe2\x80\x99s really painful'"
professordarwin,['alcohol'],"b'We were called to respond to a woman in distress suffering from alcohol poisoning. She was erratic and confused, but we were able to calm her down and gave her a place to recover. While we were stabilizing her, a man entered suffering from an opioid crash (pending OD).'"
RFfromMass,['issues'],b'@mattyglesias Which means a small fraction of Americans bear the burden of $billions in student debt. \nThe median American probably has little trouble with an extra 75c/gal  of gas. \nThe median American has no opioid addiction.\nYet we rightly include these issues in a humane policy agenda.'
CityofWilm,['overdose'],"b'(2 of 2) The Opioid Overdose Quick Response Team (QRT) program has been extremely successful in getting community members who have overdosed, or at risk of overdose, to agree to engage in a treatment program.'"
thysroes,['overdose'],"b""Along the way, I'm collecting stories about a less happy topic: the American opioid overdose crisis.\n\nThere are many sides to this story and I hope to collect perspectives  from all angles. I will share more about this later but comments about #Fentanyl already welcome."""
phil_luttazi,['alcohol'],"b'@AnthemScott @robkorobkin A known unknown is that\nsome will still die even with full legalization. Approximately 95K alcohol related deatfs per year. Prescription opioid ""epidemic"" took place notwithstanding underlying safety of the meds.'"
DrPoorman,['overdose'],"b'@Kensinghenge If people are opioid naive, I they could theoretically overdose, esp kids. But given the drug supply I think it is a reasonable approach'"
BinSu37630864,['overdose'],"b'@hotnurses468 @sbhank It was always used as emergency medicine for opioid overdose, at least that is what I taught in class. This unique new activity hasn\xe2\x80\x99t been added to textbook yet, but I will update my ppt.'"
hotnurses468,['alcohol'],b'@BinSu37630864 @sbhank Yes. We use it for alcohol and opioid dependence.'
hammerheadhope,['depression'],"b'@NIH_NCCIH @TeamKratom @UF Yes! It *can* help (but not cure, as nothing can) the opioid crisis. &amp; don\xe2\x80\x99t forget about those of us in #ChronicPain . #kratom has helped me greatly &amp; i don\xe2\x80\x99t have to worry about CNS depression or dying.'"
jasmeen_b17,['overdose'],"b'This study aimed to discover any patterns among opioid users who died due to opioid overdose it was since revealed that deaths in Ontario, Canada were caused by users whose intentions were to misuse and contribute to drug diversion.'"
TrollyM06987566,['issues'],"b""@Boogie2988 @Masongham I was aware it was used for pain management and such, but I didn't know opiates are actively prescribed for mental health issues. That seems like a slippery slope that contributes to the overall opioid crisis, no?"""
duseanjohnson,['issues'],"b""@getfiscal you hit home with that. hamilton is rampant with mental health crises and fentanyl/opioid addiction. and the pandemic, at least to my eyes, has exacerbated longstanding issues. some that people don't even know they have. Canada wide maybe. Ontario is bad atm tho, it hurts"""
jasmeen_b17,['overdose'],"b'A cohort study that was conducted on opioid prescriptions for chronic pain and overdose concluded that \xe2\x80\x9cPatients receiving higher doses of prescribed opioids are at increased risk for overdose, which underscores the need for close supervision of these patients\xe2\x80\x9d(Dunn et al., 2010)'"
marshal16954515,['prison'],"b'@LeonardBilling5 How you called blue state cities shit holes when red states wallow in opioid addiction, welfare recipients etc? Adoring a man who took out a full page ad to keep EXONERATED black men in prison, sued for housing discrimination &amp; tweeted a man yelling white power, the shoe may fit'"
TheDissenter4,['problems'],"b'@CandiceBergenMP Climate crisis, housing crisis, healthcare crisis, opioid crisis, inequality crisis.\n\nBut trust the CPC to ignore our real problems and spend our $$ on weapons of war.\n#cdnpoli'"
erod550,['problems'],"b""@atrupar Claims to care about Ohio's opioid problems. Most definitely will not vote to hold big pharma accountable."""
bogiestl,['problems'],b'@RedRisinginIL @zephyrs36 @browngravy_93 @ibdgirl76 @Irishbrat1966 What seems to cause problems is inadequate pain management at the onset of the problem. So blocking opioid use early may actually lead to more later.'
willinois,['overdose'],"b""They're launching expansion of suburban behavioral health unit with ARPA funding.\nFocusing on opioid use, including distribution of Naloxone to law enforcement and other agencies.\n\nOpioid overdose prevention sites allow people to consume drugs in a safe environment."""
dcherring,['problems'],"b'@LMM1062 @RadioFreeTom @Timodc But that\xe2\x80\x99s not remotely true. With more refinement by the DAY, he\xe2\x80\x99s speaking to the real problems and concerns of his hoped-for constituency. Do you deny that\xe2\x80\x99s true?\n\nDo i think building a border wall lowers opioid use in Ohio? No- but he\xe2\x80\x99s speaking to the problem and to Ohioans'"
madison_tayt,['enough'],"b'it\xe2\x80\x99s not enough for them to actively profit off the opioid crisis, they have to profit from the murder of people around the world too?\n\nthis is fucking disgusting'"
sa_gibson,['problems'],b'@NCaDaPi @natalie_allison Vance is blaming Mexicans for his mother\xe2\x80\x99s drug problems when he famously wrote a book explaining that she was a nurse who got addicted to opioid painkillers she stole from the hospital where she worked.'
danielgravesphd,['overdose'],"b""@ResearchAtJeff @ijdrugpolicy @megkreed @RisingKristin @JeffKHom @PHLPublicHealth The opioid crisis is truly an overdose crisis.  These strips can save lives.  Let's all do our part."""
LoopersProShop,['problems'],"b""@TheDennyKing @MattGinella @firepitstories His problems, despite the golf industry's best efforts to bury and move on, are well known. He has a very addictive personality. His addiction to competition lead to an opioid problem. There's no chance, which the pain he's described, that he's playing clean.  Cycle is repeating"""
MFDanielFreeman,['criminal'],"b""@CMerandi I agree with the antipsychotics, but ketamine can work for pain, but if used it should be used ALONGSIDE opioid not as a replacement for them. Using it to avoid treating a patient's pain properly with opioids is criminal."""
NoThebaine,['anxiety'],"b""@cbcnewsbc By way of contrast, media seldom reports medical studies showing caffeine increases risk of birth defects&amp;heart arrhythmia,&amp;can exacerbate anxiety disorders. It's the most common drug addiction w/pleasurable psychoactive&amp;unpleasant/intolerable w/drawal effects(like opioid habits)"""
StraylightWTF,['enough'],"b'@NightmareLoki Opioid addiction is a real thing. You\xe2\x80\x99re smart enough to know this, but absolutely do NOT give them so much as a pill.'"
IrelandsDemand,['criminal'],"b'@JunkieTrump @MikeDeVillaer @LukeNiforatos In 2021 a recovering Irish opioid addict was given a criminal conviction for \xe2\x82\xac4 worth of cannabis, which he was using (successfully) to stay off opioids.\n\nHe was convicted as a dangerous criminal, forced into drug rehabilitation &amp; forced back onto opioid drugs\n\n#ProhibitionKills'"
ReddySalina,['overdose'],"b'Nationally, #tribal communities have been among the hardest hit by the #opioid #epidemic. According to the House Committee on #natural #resources, #Native #people are almost 50 percent more likely to #die of an opioid #overdose than any other group.'"
MayorGorton,['overdose'],"b'They are the recipients of the 2022 Dr. Rice C. Leach Public Health Hero Award. Dr. Sharon Walsh is the principal investigator for the $87 million HEALing Communities Study to reduce opioid overdose deaths, which increased during the pandemic. (3/4)'"
theskiter,['overdose'],"b'@MarshaBlackburn Approximately 60,000 TN suffer from some form of dependence on prescription narcotics. TN ranks #2 in the nation for opioid use, with East TN having the highest opioid consumption in the state. 1,776 TN died from drug overdose in 2017. Of those deaths, 1,268 were from opioids.'"
janetmulkey111,['depression'],"b'@colleengrott I have information that any drug with a ""Z"" in the name is sadly a poison and an opioid.  Overdose can lead to depression.  The problem is it builds up and sustains, not eliminated.'"
relliK_booN,['enough'],b'@KingBlackBored @PuffYatty @TenaciousEth No different then our own gov causing the crack epidemic fully proven and exposed\xe2\x80\xa6 sure enough we go to Afghanistan the worlds largest poppy plant population in the world\xe2\x80\xa6 oh what do you know. The opioid epidemic surged through america the years to follow. Sickness and evil.'
Shaughn_A2,['overdose'],"b'@costumerchick Yeah\xe2\x80\xa6I thought that too. Wouldn\xe2\x80\x99t doubt if she\xe2\x80\x99s on opioid type drugs to mitigate the pain she\xe2\x80\x99s going through. Hoping not, but she might end up being an overdose casualty down the road \xf0\x9f\x98\x94'"
Sometimesimsads,['issues'],"b'@LOCALOUTSIDE @secondchances09 I agree that abusing opioid prescriptions is what causes issues. It\xe2\x80\x99s when people take extra pills, snort them, or take them closer together. I never get \xe2\x80\x9chigh\xe2\x80\x9d and take 60mg a day (CRPS). My friend got hooked; he was supposed to take 1 every 6 hours and was taking 4-6 an hour.'"
NCUIH_Official,['overdose'],"b'""Opioid overdose deaths during the pandemic increased more in Native American communities than in communities for any other racial or ethnic group."" @RepKatiePorter'"
rob55172191,['legal'],b'#TheNine @RyanEFox2 I\xe2\x80\x99ve been telling everyone about #dopesick it is so eye opening!! Especially since the opioid epidemic IS still happening &amp; legal action against the family is still ongoing!'
lindellgirl,['legal'],b'@LP_TN_AR Considering #Tennessee is a Tobacco State you\xe2\x80\x99d think they\xe2\x80\x99d want to legalize #Cannabis $$$.\nInstead making #pedophilia legal. Privatizing Public Schools for profit Land Grab to Christian Evangelist Group in Michigan #Blackburn supports child abuse &amp; #Opioid Addiction #BigPharma'
HardeeErica,['anxiety'],"b'@tonydoukopil way to go for shedding light on this issue.Nowadays patients can get pot for pain or anxiety instead of addictive pills.No1 has been untouched by opioid epidemic in some form,yet the stigma of pot is still hush-hush while rx pills&amp;wine are ok.'"
samrivera1111,['overdose'],"b'""Overdose deaths attributed to opioids made up the majority of fatalities &amp; rose by 44% b/t 2019 and 2020, from 2,939 to 4,233 deaths. On average 12 people died of an opioid #overdose every day in NY in 2020.""\n\n\xe2\x9e\xa1\xef\xb8\x8fAt @NYHarmReduction @cornerproject our staff SAVE LIVES every day.'"
wineaintsweeter,['issues'],"b'Red states are broke, full of gun violence and opioid addiction. Meanwhile they use blue state funds to push hatred and not solve their issues. Why are blue states continuing to fund red states.'"
dav123mememe,['problems'],b'@ibdgirl76 the evergreen proud and certain douchebags in dhhs used the there is no alternative fallacy and damned the torpedoes because they considered people in pain problems whose pain was ungreieveable and of course legislators wished to brag about how much they reduced opioid use.'
AjayManhapra,['overdose'],b'@LeoBeletsky The bottom line is that efforts at assigning overdose deaths at the feet of a particular molecule is a useless endeavor. High risk opioid users tend to use multiple other substances that precipitate OD. This is a reality w/ both illicit and medical opioid use.'
AjayManhapra,['overdose'],"b'@LeoBeletsky We have known since at least 1970s that opioid and other overdose crisis has always been a polydrug crisis. Many are discovering this well known fact and thinks its a new phenomenon. This ""discovery"" has been happening every few decades with each new addiction crisis.'"
Graki_Khan,['problems'],"b'@Fiskantes I\xe2\x80\x99d appreciate it more if Americans would go on strike to stop the interventionist wars. Focus on your own people, fix the opioid epidemic, obeasity problems, crumbling infrastructure, outrageous tuition fees and healthcare costs.'"
kathymoorhead7,['prison'],"b'@kenolin1 @LindseyGrahamSC Our children are watching: racial riots;  crooked politicians. 60s all over #purduepharma and Dr Curtis Wright of the #FDA lied about #Oxycontin igniting the #Opioid Crisis.They have not spent one day in jail while 10,000s are in prison for nonviolent crimes due to oxy addiction'"
