realSCJ,['enough'],"b'@ScottBorg1 @catoletters It is better if you have money, an apartment, a job, enough money saved, a good healthcare, and not a minority. So like 5% of the population? and even they are not safe from stuff like the opioid epidemic and other drugs which made their way to the streets because of the CIA.'"
OfficeOfGusM,['legal'],b'The last time opiates were legal to purchase over the counter was the 2nd American opioid epidemic (out of 4) and poppy based tinctures were touted as treatments for virtually everything.\n\nBut what we\xe2\x80\x99re doing now is not working. The opioid epidemic has gotten worse with every\xe2\x80\xa6'
DrMehboobSran,['overdose'],"b""@BhagwantMann, Naloxone is life saving drug in case of Opioid overdose. Recently deaths due to heroin (\xe0\xa8\x9a\xe0\xa8\xbf\xe0\xa9\xb1\xe0\xa8\x9f\xe0\xa8\xbe) overdose have been reported among IDUs. Request the govt to make naloxone kits available for emergency use with RMP's in villages to prevent deaths"""
BlueOtter75,['anxiety'],"b'@beatingbenzo I went through that, that\xe2\x80\x99s how the dumb doctors treat anxiety ( which was a manifestation of bipolar) first Valium , then Xanax then klonopin. I cold Turkeyquit that ..and holy shit the withdrawal\xe2\x80\xa6still opioid withdrawal is worse I think'"
CollinWhites,['overdose'],b'@Farris_Actual Number one killer of adults aged 18-40 in the United states... opioid overdose...'
D_Liazon,['issues'],b'@mrpolished It\xe2\x80\x99s so crazy. It made me have some much more compassion for the opioid issues. This company preyed on people to make money. I pray for judgement'
Drugabusestats,['overdose'],b'Drug overdose deaths involving psychostimulants such as methamphetamine are increasing with and without synthetic opioid involvement.2'
stahsha,['overdose'],"b'@Phil_Nemeth @kateKIMBALL @marwilliamson We\xe2\x80\x99ve never classified a drug a weapon of mass destruction before bc none have been as lethal as fentanyl. Are you aware we\xe2\x80\x99re losing 100k people a year to opioid overdose? I want rehab available to all, but we have to go hard after fentanyl. Prevention, go after the source,rehab'"
VegasBullAnon,['arrest'],b'@Chattah4Nevada $22 million for Clark County Opioid War victims\n\nGeorge Floyd was selling fentanyl and swallowed his whole bag when cops tried to arrest him and he got $27 million \xf0\x9f\xa4\xa1\xf0\x9f\x8c\x8e'
RyanMarino,['overdose'],b'@wesxmichaels A) what he said was a lie\n\nB) the alternative to Narcan for an opioid overdose outside of the hospital is death'
EuniceE62945638,['alcohol'],"b'Adolescent marijuana use was 22% in 2019, and 13% noted in 2021\n\nAdolescent smoking use was 6% in 2019 and was 4% in 2021\n\nAdolescent vaping use was 28% in 2019 and 15% in 2021\n\nAdolescent alcohol use 19% in 2019 and 19% in 2021\n\n Adolescent opioid misuse was 7% in 2019 and 4% in'"
NevadaAG,['overdose'],"b'""In 2020, Nevada saw a 40% increase in opioid-related overdose deaths."" \n\nBut we\'re fighting back, says AG @AaronDFordNV, and we\'ve won ""pivotal battles.""'"
Anasazi5,['prison'],"b""@MarshaBlackburn Record? Really? How many opioid bills has she passed that's still killing thousands and still ruining families?\n\nOh, sorry, that would be you. You belong in prison not congress."""
LattrDayDuranie,['max'],"b'@Ledhedd2 @US_Muckraker @CMerandi While I very much believe that chronic pain pts should have access to appropriate opioid meds, the HMO is not totally wrong\xe2\x80\xa6 Norco, in itself, really ISN\xe2\x80\x99T appropriate to treat chronic pain. Even as a breakthru med it is a poor choice. Too easy to exceed APAP max daily dosage'"
theyearofjoy,['overdose'],"b'@NY_Tuck @RyanMarino It depends on the scenario. If they aren\xe2\x80\x99t monitored immediately following, the opioid can start to act again as the Narcan wears off. Sometimes it can be from the same overdose, or the person uses again without realizing there are still opioids in their system.'"
KeeganGibson,['enough'],"b'This scoring system classifies basic funding bills, bipartisan opioid bills, etc, as ""GOP votes"" in a GOP majority and ""Dem votes"" in a Dem majority. And it ignores when \xe2\x80\x98no\xe2\x80\x99 votes are protests because a bill didn\xe2\x80\x99t go far enough.'"
NoThebaine,['anxiety'],"b'@guyfelicella Trauma?Sometimes.But MOST are addicted to substances,(junk food) - &amp; CAFFEINE being most common:Pleasurable psychoactive&amp; unpleasant/intolerable w/drawal effects.Same mechanism as an opioid addiction.&amp;Caffeine is not benign: can prompt heart arrhythmia,&amp; worsen anxiety disorders.'"
seasidesharon,['headache'],"b'remember when the gov. said this drug was safe:Darvon / Darvocet was on the market for 55 years as an opioid pain reliever. And while the \xe2\x80\x9cnon-narcotic analgesic with the potency of codeine!\xe2\x80\x9d may have gotten rid of that headache, it was awful for your heart'"
scooties123,['issues'],"b'If I can find one #attorney with a real mission to sue #suboxone &amp; all the known issues (dental, just another opioid, doctors get 8 hr class).  Where\xe2\x80\x99s the #oxycontin ms gusto?'"
luxefaire,['overdose'],"b'fentanyl has disrupted the North American market for illegal drugs,capitalizing on demand for opiates such as heroin and prescription pharmaceuticals. In 2016, fentanyl was the most common cause of overdose deaths in the US,more than 20,000, about 1/2 of all opioid-related deaths'"
seaweed_actual,['issues'],"b'@kriissaa_krae Obesity related issues (CHF, diabetes, renal failure) and opioid addiction are what I see the most of on a daily basis.'"
jknowles1228,['criminal'],b'@elonmusk help me fund a foundation to lobby Congress to separate simple drug users from the criminal justice system. It is my life long dream to help others who have been affected by pharma and the opioid epidemic. I have brains and will but no \xf0\x9f\x92\xb0#help #elon #change'
kanoyume,['overdose'],"b""@DrNerdLove I keep trying to think of something funny, but all I can come up with is 'fatal opioid overdose'.  It just echoes in my mind.  I guess that's just where my head is at."""
awoaca,['legal'],"b""@BrianMannADK Your dispassionate reporting during the opioid investigations and subsequent legal complications has been greatly appreciated. I look forward to hearing informative and accurate analysis of fraught situations, and the 'look what I found today' bits, too."""
ADHD_93,['depression'],b'Like in the past 20 years after the opioid epidemic quite a lot of med came to arise to reduce opioid cravings and even substitute the addiction itself w/ something safer. For meth? There\xe2\x80\x99s nothing that can help you get off the drug. Just crippling agonizing depression for months'

nraddy,['overdose'],"b'@MIHospitalAssoc A1:ED MOUD is starting buprenorphine, the medication that treats opioid withdrawal and prevents overdose, directly in EDs. Previously patients would have to suffer withdrawal or continue using drugs as they looked for treatment out of the hospital. #MHAHealthChat #MAT #MOUD'"
cfsem,['overdose'],"b'@MIHospitalAssoc A2: ED MOUD is evidence-based and increases access to treatment and follow up care. MOUD helps decrease overdose deaths, reduce opioid use, sustain recovery, decrease Hepatitis C and HIV rates, improve social functioning, and decrease healthcare costs #MHAHealthChat #MAT #MOUD'"
JoyGammon2,['overdose'],b'@thehill How do people like this keep getting elected? Ask her what drug company gave money to her campaign; makers of Oxycontin. Ask her how many people died of an overdose of the drug in Tenn. She will act as if she has never heard of the opioid epidemic. CRT has gone low.'
pwdrpuffgirl,['enough'],"b'These Tim Hortons workers don\xe2\x80\x99t get paid enough to be front line workers in the opioid epidemic, being verbally abused by users to let them use the washroom #langleybc'"
lot_lizard_heat,['overdose'],"b""of course the straightedge thing was a response to seeing my step-dads addiction to heroin, my mom's addictions, and a crisis of opioid overdose in my town.\n\nbeing vegan was a response to gruesome cruelty I saw at big farms near where I grew up."""
vOteBLUE_Ruin_Q,['criminal'],"b'@MarshaBlackburn Marsha Blackburn took $700,000.00 from the #opioid industry as 1000\xe2\x80\x99s died from opioid #addiction in #Tennessee Marsha is a criminal'"
dawnimatrix,['alcohol'],"b'@Chrissy_8675309 @katman_steven @ravensspirit68 I know. Not One day goes by without seeing or hearing something having to do with how \xe2\x80\x9charmful, awful and addictive\xe2\x80\x9d an opioid can be. For instance: portrayed on yet another popular streaming show (won\xe2\x80\x99t mention title), a woman drinking alcohol while taking a benzo! Stop!\xf0\x9f\x98\xa3cont-'"
manbearchipmunk,['legal'],b'@TNGOP hates gay marriage so much that making child brides legal is ok. Also loves opioid money more than killing a 100 million dollar hemp and #DELTA8 industry in #Tennessee'
madras_bertha,['overdose'],"b'@nicolemluongo @mccaffreyr3 @Twolfrecovery @KevinSabet @KeithNHumphreys @LukeNiforatos Inaccurate. People became alarmed because of unprecedented, steep rise in Rx opioid misuse, escalating  Rx OUD and Rx opioid overdose deaths. Safe, pristine regulated Rx opioids being misused caused havoc. The data speak, not views that promote political constructs.'"
asherose17,['legal'],"b'@MarshaBlackburn Active shooter drills, opioid crisis, pols taking money from opioid producers and gun industry, but DO focus on nonexistent CRT. It\xe2\x80\x99s a legal theory TAUGHT IN LAW SCHOOLS'"
MajorBriggz,['overdose'],"b'$ADMP just launched a product \xe2\x80\x9cZIMHI\xe2\x80\x9d in the rapidly growing opioid overdose market, they\xe2\x80\x99re now in the ph3 portion of their NIH backed covid therapeutic Tempol, and will re-release \xe2\x80\x9cSymjepi\xe2\x80\x9depinephrine injection in the near future.  Re-entry @.55 holding until data readout.'"
PERCAJIT,['overdose'],b'@FLAWLESSLUCKI You won\xe2\x80\x99t if you die from opioid overdose'
Kit86421,['criminal'],"b'@tarunkanojia The ultimate black pill!\n\nVioxx, Factor VIIi, AZT, Opioid Epidemic,J&amp;J Sunscreen &amp; talcum powder, and Pfizer\xe2\x80\x99s criminal record didn\xe2\x80\x99t stop this, and many more examples. why would it stop now?\n\nI worry everyday they pull this off like they have before. Yet hope they\xe2\x80\x99ve gone to far'"
iamnisakaran,['overdose'],"b'Lastly, the Act \xe2\x80\x9cimposes new requirements on employers to have naloxone kits and related training where there may be a risk of a worker having an opioid overdose at work.\xe2\x80\x9d'"
YvetteNunes,['enough'],b'How much yarn would you need to buy? What would that look like? How many self help books have you read? At what point do you give up trying to change things? Simple policy changes that would save hundreds of lives but no\xe2\x98\x9d\xef\xb8\x8fhas the courage to say enough. No more opioid overdoses.'
knitntherapist,['overdose'],"b'@LGSentinel @TripleThreat_MD @RedTriage Checked Ontario\xe2\x80\x99s Narcan policy.\n\nKits of injectable/nasal spray are available free at pharmacies. The pharmacist will assist you with some training on how to administer, as well as how to recognize an opioid overdose in the wild.\n\n(Given our current government, I\xe2\x80\x99m surprised)'"
Geoffre05087832,['issues'],"b""@Fabfucious @iBenyamin @SonofMzansi @TorraineWalker You shouldn't be worrying what they think of us at all young brother! Let them handle and worry about their pedophilia, opioid epidemic, and mass shooting issues which they NEVER talk about! Just be you, and improve yourself and work HARD to achieve your dreams. \xe2\x9c\x8a\xf0\x9f\x8f\xbe\xe2\x9d\xa4\xef\xb8\x8f"""
james_e_b_,['overdose'],"b'I think possibly it\'s deliberately phrased in a misleading way. What is a ""round"" of narcan? Does that mean one dose? You might need several doses to revive one overdose, especially if the patient has overdosed on a long-acting opioid, since narcan wears off quickly'"
CKawehi13,['overdose'],b'@deadeyedmusic @sakraofficial Suboxone was my life saver. If we get more safe injection sites there will be judgement free places opioid addicts can go to get suboxone or even just to prevent accidental overdose while they build a relationship and eventually get clean.'
OhioEricJones,['prison'],"b'Addiction and the opioid crisis have hit Americans very hard. This is why we need to begin transitioning the War on Drugs toward a more healthcare-centered focus regarding non-violent drug users. \n\nBy promoting rehab over prison, people can more easily reform and recover. #OH06'"
PragueorBrno,['overdose'],"b""@drowsygeek @GhanaboyPharmd If you're giving 24mg of narcan you're missing a different problem, it's not an opioid overdose. If it were, they'd be awake after 0.2 IM or 2-4mg nasal spray. 24mg happens with nonmedical people who are assuming its opiates, but it isn't."""
LACEdaFlyFellow,['depression'],b'@BKerojack @shadowgalaxia @mitchellscomet @jimmyfafalocums @TripleThreat_MD Buprenorphine =/= Naloxone.\n\nThey frequently come together (to deter iv use of the former) but that\xe2\x80\x99s not relevant.\n\nThe point is that the respiratory depression from an opioid is far more devastating than any possible withdrawal in an unresponsive patient.'
JimAron3,['overdose'],"b'@Rostriak @FinEssentials @kylenabecker Easy to make that mistake being such a successful, Libertarian ""Podcaster"" from the Opioid overdose capital of the Country thanks to their #Seditious Senator who took  $540,000 + from Big Pharma.'"

latchkeykidd,['overdose'],"b'@GhanaboyPharmd In our sample of ~90 patients with suspected opioid overdose treated in the prehospital setting, only 5% required a third dose (i.e., &gt;8 mg). But overtreating (reversing hypoxemia and preventing death) is always better than undertreating in uncontrolled settings.'"
RecoveryOccupy,['alcohol'],b'@JimMea My short term response to this (i.e. what I tell my patients new to recovery &amp; on buprenorprine (yes I consider being on opioid agonist therapy being in recovery)) is \xe2\x80\x98consider giving yourself a break from all mood altering substances to include marijuana and alcohol for a year.\xe2\x80\x99'
TransLeBatard,['depression'],b'@EbCummings1 Patients on chronic opioid therapy have been shown to have relatively higher levels of comorbid clinical depression of up to 38%.It has been shown that patients on chronic opioid therapy with comorbid mental illness have a significantly higher amount of emergency room visits. \xe2\x9c\x8c\xef\xb8\x8f'
HarryRhetoric,['overdose'],"b'@cmross415 @Kpascuch @TeamKratom From that same article: ""Mitragyna speciosa, also known as kratom, has the potential meet the need for pain medications that lack the addictiveness and overdose risk of classical opioid analgesics, such as morphine. ""'"
denisebolton,['overdose'],b'This opioid crisis is killing people! There are more than 160 overdose deaths per day! 22.8% of all deaths in the US are due to drug overdoses! and 2nd to homicide in ages 15-49!   Removing the stigma &amp; having affordable treatment options are 2 small steps in the right direction'
Pain_Speaking,['enough'],"b'2) ED discharge filled at least 2 opioid prescriptions in 6 months, only 1% had persistent opioid use. These patients with persistent opioid use were likely to report moderate or severe pain 6 months after the ED visit.""\n\nHaven\'t you caused enough harm to #PatientsInPain yet?'"
MatlockS1974,['enough'],"b'@MarshaBlackburn Only those ignorant and racist enough to have anything to do with you. Why\xe2\x80\x99d you run from the opioid questions? Think that\xe2\x80\x99s ok? Vote her out, folks.'"
BKerojack,['overdose'],"b'@Nanon20001 @mitchellscomet @jimmyfafalocums @TripleThreat_MD The original claim was that it was side effect free in every circumstance except opioid overdose. If you\xe2\x80\x99re a pro you should know that\xe2\x80\x99s not true and a potentially harmful statement to make. If you\xe2\x80\x99re offended by me pointing out the potential harm, I don\xe2\x80\x99t know what to tell you.'"
ayoisblack,['enough'],"b""@FefferinoP @shaw_sandy @AndreaHorwath Ok, I'll stick to the party that causes the least damage. IMO, anywhere there's a LiberalNDP presence, there's a massive housing crisis, opioid crisis, not enough jobs, more people needing mental health services etc."""
Charmunkle,['issues'],"b""@Xpropriation @Jerny16 @thehill What is happening over there is terrible, uncalled for etc but let's use the resources ($$) to stop issues we're having here. Opioid epidemic (100,000 deaths) would be a great place to start."""
KemiOlunloyo,['depression'],"b'#EndDrugAbuseNG \n\nOpiates and Narcotics: Same thing. A class of drugs like morphine, codeine, heroin, oxycodone, fentanyl, and methadone. These drugs act at the opioid receptors within the nervous system and can cause analgesia, respiratory depression, constipation and euphoria.'"
HappyJesse,['overdose'],"b'@ajtourville @WR4NYGov @FuturamaKing @Zlartibartfast Alcohol related deaths are on rise closer to 95k/yr in \xf0\x9f\x87\xba\xf0\x9f\x87\xb8, on rise \n\nOpioids related deaths are from overdose \n\n70% of opioid related deaths are from synthetic opioid overdose\n\nHeroin related deaths are lower than prescription opioids related deaths'"
m_cyndi,['overdose'],b'@MarshaBlackburn Stop killing your constituents. What are you doing to stop opioid overdose in your state.'
LawlorNanci,['overdose'],"b""@NewDemCoalition \nas far as your visit to Fox news and Martha Mcallen,\nI still do not undertand why there is not any discussion on the opioid crisis. The leading cause of death ages 18-49, is opioid overdose. Isn't it worth mentioning? why  \ndoesn't Biden think of that on border?"""
Crushgroovin1,['enough'],"b""@headdock @Wanita1 @james_e_b_ @DecrimAdvocate @maiasz @JeffJBettinger @GhanaboyPharmd @JeffreyFudin I've had limited success with movantic. I also experience opioid induced urinary retention and have to take Tamsulosin. Along with dependency after 3-4 days of use. Nausea, itching, and tolerance, as well. There isn't enough talk of the non fatal side effects."""
kimster_giggles,['stress'],b'@Samsara_Rain I hadn\xe2\x80\x99t been approved for disability at that point so I couldn\xe2\x80\x99t get an MRI. I was pregnant with kiddo and delivered her c-section with that stress fracture. She was one when it cracked. X-rays wouldn\xe2\x80\x99t show it. Too much opioid pain killers. It still hurts but I\xe2\x80\x99m pill free \xf0\x9f\x98\x81'
phil_luttazi,['enough'],"b'@gunpolicy Exactly. There are also leading States in terms of lowest mortality from Covid, opioid overdoses, traffic fatalities, pedatric cancer etc., etc., etc. Clearly those states have already down enough addressing those and should seek no further reductions.\nAstounding logic.'"
pppupu10085,['problems'],"b'@remnantposting As we watch our societies fall apart, more or less conquered by a foreign regime without using weapons, I can see the social/mental/spiritual impact this has on people. Consider the opioid users, slave descendant/first nation identity/crime problems in US/Canada.'"
glstarks34,['enough'],"b'@TIME The opioid crisis is a monster of own making, driven by 1980/1990s laws removing medical liability and catering to drug lobbyists. Lawmakers have to reverse the laws they passed to combat this issue. Not enough to go after traffickers without holding drug companies accountable.'"
Wanita1,['depression'],"b'@DecrimAdvocate @headdock @james_e_b_ @maiasz @JeffJBettinger @GhanaboyPharmd @JeffreyFudin 1/agree that offering an antidepressant when one has mod-severe pain,in place of an opioid,is maddening. But offering one when one is put on opioid therapy is not.ChP as well as LTOT can lead to depression'"
StevieChristine,['overdose'],"b'@iamjohnoliver If you want to learn more about narcan, recent advances in opioid overdose treatments, and the fentanyl epidemic keep your eye out for my new publication with Dr. Sharon Walsh, coming out in psychopharmacology soon!'"
TerynceB,['overdose'],"b""@FatSealion1 @TripleThreat_MD Opioid overdose = give narcan. That's the care. \n\nIf someone is administering CPR, would you ask them how they were notified? If they had their physician's card on them? Current on all their dues?"""
JayKuchera,['overdose'],"b'@headdock @JeffreyFudin @JeffJBettinger @GhanaboyPharmd Great job! Conflating risk of clinical opioid therapy w overall risk is not OK. Rx opioid overdose risk data is wildly divergent, from 2 fold to 9 fold increase &gt;100 MME. And the gradient (curves) are not as steep as stated by the anti-opioid camp. Keep going!'"
headdock,['depression'],"b""@james_e_b_ @Wanita1 @DecrimAdvocate @maiasz @JeffJBettinger @GhanaboyPharmd @JeffreyFudin I understand that most opioid users are depressed, and some have posited that it's the opioids themselves that CAUSE the depression (e.g., Mark Sullivan). However, I don't sense that many are overdosing purposefully."""
Quixotic_Moron,['legal'],b'@TIA_Lucas20520 @TimboGhost1989 Bribery. Opioid sales are roughly $10 Billion dollars a year. Paper sales are roughly $40 Billion dollars a year. Those are just the two most obvious industries that would be altered/end if marijuana were legal. The republicans are the most crooked government money can buy.'
IdiotTracker,['overdose'],"b""@FiveOhFour @TripleThreat_MD @RyanMarino I used to work in the 911 system. In a well-resourced, dense urban area, a good EMS response time is 6-8 minutes. In rural counties, that can be 15, 20, 30 minutes or even longer. Opioid overdose kills bc you stop breathing. Even 6 minutes without oxygen, you'll never be the same"""
SeanStacey18,['alcohol'],"b'@SenSanders NPR story said LSD,toad toxins and silly mushrooms can treat people for opioid and alcohol addiction'"
7motivation_24,['alcohol'],"b'The best way to get started is to quit #rhyming, and begin doing.\n- Silent Bob\n\n#SilentBob\n\n#medicaid  #mentoring  #quote  #clouds  #Competition  #opioid  #alcohol  #Entrepreneurship  #motivations  #HappyEaster'"
JayBucklew,['issues'],b'@ZachWritesStuff @3littleredbones I know people that were prescribed fentanyl patches before the opioid crisis became full blown and prescriptions were closely monitored and limited.\n\nStories like this help me understand how blatantly uniformed people can be when it comes to basic health issues. Thanks! \xf0\x9f\x91\x8d'
stahsha,['overdose'],"b'@marwilliamson Fentanyl is a whole new world. I agree with the father of a son who died of opioid overdose - we must classify  #fentanyl as a weapon of mass destruction, bc it is, and then we can go after the production at its source and not punish small time drug dealers who are most likely\xe2\x80\xa6'"
UnwarrantedDes,['legal'],b'@HairHoKitty @thehill Correlation does not equal causation. We have legal weed here and our opioid crisis is still ongoing.'
GNMuturi,['issues'],"b'Driving through Kensington and Center city is heartbreaking as you get to experience the raging opioid crisis, the heroin-plagued Kensington neighborhood and extreme homelessness. How can this issues be addressed? \xf0\x9f\xa4\x94\xf0\x9f\x98\xad\xf0\x9f\x98\xa4\nCc @Kevo_vLOGGER'"
blikethecheese,['overdose'],"b'@MalindaSgtRet @OrangeCoSheriff @valenciacollege Copganda. Not medically plausible. I administer opioids every day, that\xe2\x80\x99s not  what an opioid overdose looks like. If you genuinely are interested, I\xe2\x80\x99d be happy to share information.'"
TripleThreat_MD,['overdose'],"b'I won\xe2\x80\x99t disclose details for privacy, but I responded to a community opioid overdose tonight\xe2\x80\xa6 and I\xe2\x80\x99ll never leave the house w/out narcan.\n\nAlso, dear Boston PD\xe2\x80\xa6 there is no contraindication for administering narcan, so when a doctor on-scene asks for your supply, don\xe2\x80\x99t refuse.'"
GreenKnight925,['criminal'],"b""@KathyHoldshope Anyone with chronic conditions that are on opioid therapy are now being treated like addicts.\n\nAnd if they fail to find relief; they're forced into the black market to try and find respite.\n\nHorrible, criminal, and unjust!!!"""
means_over,['issues'],b'@Kanta_Mizuno @ThtEnbyUEnvy @HumanistReport @jk_rowling You think trans issues are more important that the homelessness crisis or the opioid crisis. \n\nThis \xe2\x80\x98trans\xe2\x80\x99 issue is meant to divide and conquer. \n\nDon\xe2\x80\x99t get so emotional over nonissues. Put that angst at something more meaningful.'
madkade,['issues'],"b'@ClarkHa24243469 Somewhat like WV coal mining towns, that are now depressed, filled with the opioid addicted, &amp; people dying from health issues stemming from coal mines to improper nutrition. Instead of Putin, WV has Manchin &amp; Justice.'"
AReddingDPM,['rely'],"b'@rkh_md With the scrutiny on opioid prescribing in my state, I rely a lot on IV acetaminophen, nsaids and local block of exparel with as little narcotic as possible. Works pretty well'"
jaycamillle,['overdose'],b'I wonder what state do people be in when they have an opioid overdose. Like do they be seeing the light or they just die for a min'
GmanInfamous,['overdose'],"b'You know we think we have a crisis in England because like 300 people got stabbed to death in a year. 70,000 Americans died of opioid overdose last year. That\xe2\x80\x99s a real issue. \n\nKnife crime has always fluctuated between 200 and 400 murders. That ain\xe2\x80\x99t many'"
UmmAneesa,['alcohol'],"b'@3YearLetterman @SenSanders Hate to break the news to you, but marijuana is a plant. Can you please cite the number of overdoses from MJ in any given year? Now compare that to opioid overdoses, or deaths from alcohol or tobacco. What are your stats? P.S. it\'s ""Senator"" Sanders.'"
